{"arms":{"appss-2of3":{"authorization_quorum":4,"family":"appss","holders":[1,2,3],"k":2,"n":3,"policy_id":"LOCUS-canonical-email-set-v1","result_id":"LOCUS-managed-state-result-appss-v1","suite_id":"LOCUS-APPSS-2HASHDH-RISTRETTO255-SHA512-GF128-v1","topology_id":"LOCUS-paired-suite-deployment-2of3-v1"},"appss-3of5":{"authorization_quorum":4,"family":"appss","holders":[1,2,3,4,5],"k":3,"n":5,"policy_id":"LOCUS-location-person-set-v1","result_id":"LOCUS-managed-state-result-appss-v1","suite_id":"LOCUS-APPSS-2HASHDH-RISTRETTO255-SHA512-GF128-v1","topology_id":"LOCUS-paired-suite-deployment-3of5-v1"},"yi-2of3":{"authorization_quorum":4,"family":"yi","holders":[1,2,3],"k":2,"n":3,"policy_id":"LOCUS-canonical-email-set-v1","result_id":"LOCUS-managed-state-result-yi-v1","suite_id":"LOCUS-TPASS-YI-ZK-RISTRETTO255-v1","topology_id":"LOCUS-paired-suite-deployment-2of3-v1"},"yi-3of5":{"authorization_quorum":4,"family":"yi","holders":[1,2,3,4,5],"k":3,"n":5,"policy_id":"LOCUS-location-person-set-v1","result_id":"LOCUS-managed-state-result-yi-v1","suite_id":"LOCUS-TPASS-YI-ZK-RISTRETTO255-v1","topology_id":"LOCUS-paired-suite-deployment-3of5-v1"}},"evidence_profile_id":"LOCUS-managed-state-evidence-profile-v1","format_id":"LOCUS-managed-state-scenario-manifest-v1","report_count":42,"reports":[{"arm_id":"yi-2of3","result_id":"LOCUS-managed-state-result-yi-v1","scenario_id":"SB01"},{"arm_id":"appss-2of3","result_id":"LOCUS-managed-state-result-appss-v1","scenario_id":"SB01"},{"arm_id":"yi-3of5","result_id":"LOCUS-managed-state-result-yi-v1","scenario_id":"SB01"},{"arm_id":"appss-3of5","result_id":"LOCUS-managed-state-result-appss-v1","scenario_id":"SB01"},{"arm_id":"yi-2of3","result_id":"LOCUS-managed-state-result-yi-v1","scenario_id":"SB02"},{"arm_id":"appss-2of3","result_id":"LOCUS-managed-state-result-appss-v1","scenario_id":"SB02"},{"arm_id":"yi-3of5","result_id":"LOCUS-managed-state-result-yi-v1","scenario_id":"SB02"},{"arm_id":"appss-3of5","result_id":"LOCUS-managed-state-result-appss-v1","scenario_id":"SB02"},{"arm_id":"yi-2of3","result_id":"LOCUS-managed-state-result-yi-v1","scenario_id":"SB03"},{"arm_id":"appss-2of3","result_id":"LOCUS-managed-state-result-appss-v1","scenario_id":"SB03"},{"arm_id":"yi-3of5","result_id":"LOCUS-managed-state-result-yi-v1","scenario_id":"SB03"},{"arm_id":"appss-3of5","result_id":"LOCUS-managed-state-result-appss-v1","scenario_id":"SB03"},{"arm_id":"yi-2of3","result_id":"LOCUS-managed-state-result-yi-v1","scenario_id":"SB04"},{"arm_id":"appss-2of3","result_id":"LOCUS-managed-state-result-appss-v1","scenario_id":"SB04"},{"arm_id":"yi-3of5","result_id":"LOCUS-managed-state-result-yi-v1","scenario_id":"SB04"},{"arm_id":"appss-3of5","result_id":"LOCUS-managed-state-result-appss-v1","scenario_id":"SB04"},{"arm_id":"yi-2of3","result_id":"LOCUS-managed-state-result-yi-v1","scenario_id":"SB05"},{"arm_id":"appss-2of3","result_id":"LOCUS-managed-state-result-appss-v1","scenario_id":"SB05"},{"arm_id":"yi-3of5","result_id":"LOCUS-managed-state-result-yi-v1","scenario_id":"SB05"},{"arm_id":"appss-3of5","result_id":"LOCUS-managed-state-result-appss-v1","scenario_id":"SB05"},{"arm_id":"yi-2of3","result_id":"LOCUS-managed-state-result-yi-v1","scenario_id":"SB06"},{"arm_id":"appss-2of3","result_id":"LOCUS-managed-state-result-appss-v1","scenario_id":"SB06"},{"arm_id":"yi-3of5","result_id":"LOCUS-managed-state-result-yi-v1","scenario_id":"SB06"},{"arm_id":"appss-3of5","result_id":"LOCUS-managed-state-result-appss-v1","scenario_id":"SB06"},{"arm_id":"yi-2of3","result_id":"LOCUS-managed-state-result-yi-v1","scenario_id":"SB07"},{"arm_id":"appss-2of3","result_id":"LOCUS-managed-state-result-appss-v1","scenario_id":"SB07"},{"arm_id":"yi-3of5","result_id":"LOCUS-managed-state-result-yi-v1","scenario_id":"SB07"},{"arm_id":"appss-3of5","result_id":"LOCUS-managed-state-result-appss-v1","scenario_id":"SB07"},{"arm_id":"yi-2of3","result_id":"LOCUS-managed-state-result-yi-v1","scenario_id":"SB09"},{"arm_id":"appss-2of3","result_id":"LOCUS-managed-state-result-appss-v1","scenario_id":"SB09"},{"arm_id":"yi-3of5","result_id":"LOCUS-managed-state-result-yi-v1","scenario_id":"SB09"},{"arm_id":"appss-3of5","result_id":"LOCUS-managed-state-result-appss-v1","scenario_id":"SB09"},{"arm_id":"yi-2of3","result_id":"LOCUS-managed-state-result-yi-v1","scenario_id":"SB14"},{"arm_id":"appss-2of3","result_id":"LOCUS-managed-state-result-appss-v1","scenario_id":"SB14"},{"arm_id":"yi-3of5","result_id":"LOCUS-managed-state-result-yi-v1","scenario_id":"SB14"},{"arm_id":"appss-3of5","result_id":"LOCUS-managed-state-result-appss-v1","scenario_id":"SB14"},{"arm_id":"2of3-paired","result_id":"LOCUS-managed-state-result-common-v1","scenario_id":"SB08"},{"arm_id":"3of5-paired","result_id":"LOCUS-managed-state-result-common-v1","scenario_id":"SB08"},{"arm_id":"managed-common","result_id":"LOCUS-managed-state-result-common-v1","scenario_id":"SB10"},{"arm_id":"managed-common","result_id":"LOCUS-managed-state-result-common-v1","scenario_id":"SB11"},{"arm_id":"managed-common","result_id":"LOCUS-managed-state-result-common-v1","scenario_id":"SB12"},{"arm_id":"managed-common","result_id":"LOCUS-managed-state-result-common-v1","scenario_id":"SB13"}],"scenario_contracts":{"SB01":["C03","C06","C13","C21","C22"],"SB02":["C04","C24"],"SB03":["C05","C24"],"SB04":["C19","C23","C25"],"SB05":["C26"],"SB06":["C07","C08","C16","M03"],"SB07":["C10","C22"],"SB08":["C11","C26"],"SB09":["C06","C21","M02"],"SB10":["C14","C15","M01"],"SB11":["C08","C16","M03"],"SB12":["C16","M04"],"SB13":["C07","M05"],"SB14":["C03","C04","C05","C20","M01","M02","M03","M04","M05"]},"status":"assigned"}
